{
  "schema_version": "case_pack_v0",
  "generator": {
    "script": "scripts/build_case_packs.py",
    "built_at": "2026-08-15T09:06:59+00:00",
    "corpus_snapshot_id": "snap_7484a10220422056",
    "parser_version": "1.0.0"
  },
  "case_id": "CASE-001",
  "company": {
    "corp_name": "에코프로비엠",
    "listed_name": "에코프로비엠",
    "corp_code": "01160363",
    "stock_code": "247540",
    "industry": "소재",
    "sector": "2차전지"
  },
  "case_title": "4,732억원 증설 결정 — 2차전지 양극재 CAM9",
  "simulation_date": "2023-05-23",
  "difficulty": "normal",
  "mission": "2023년 5월 23일. 에코프로비엠 이사회가 자기자본의 31.8%에 해당하는 신규 증설 투자를 결의했다. 이 시점까지 공개된 공시만 조사해서, 이 투자가 회사의 체력으로 감당 가능한 규모인지 판단하라.",
  "intro": "전기차 배터리 수요가 폭발하던 시기다. 에코프로비엠은 하이니켈 양극재를 만들어 삼성SDI·SK온 같은 셀 제조사에 판다. 회사는 포항 제4캠퍼스에 연 54,000톤 규모의 CAM9 라인을 새로 짓겠다고 발표했다. 발표문에는 투자금액과 자기자본 대비 비율이 적혀 있다. 그런데 같은 시점 분기보고서에는 다른 이야기도 함께 적혀 있다. 당신은 2023년 5월 23일의 투자자다. 미래 주가는 모른다. 공시만 본다.",
  "available_documents": [
    {
      "document_id": "D01",
      "doc_id": "exchange_20230523900365",
      "rcept_no": "20230523900365",
      "title": "신규시설투자등 (2023-05-23 이사회 결의)",
      "document_date": "2023-05-23",
      "source_type": "exchange",
      "doc_subtype": "신규시설투자등",
      "report_nm": "신규시설투자등",
      "is_correction": false,
      "role": "trigger",
      "original_text": "1. 투자구분 | 신규시설 투자\n2. 투자내역 | 투자금액(원) | 473,200,000,000\n2. 투자내역 | 자기자본(원) | 1,488,215,127,423\n2. 투자내역 | 자기자본대비(%) | 31.8\n2. 투자내역 | 대규모법인여부 | 해당\n3. 투자목적 | - 하이니켈 NCM 양극활물질 생산능력 확대- 신규제품 NCMX 생산시설 구축- 단결정 양극활물질 양산라인 확대\n4. 투자기간 | 시작일 | -\n4. 투자기간 | 종료일 | 2024-12-31\n5. 이사회결의일(결정일) | 2023-05-23\n-사외이사 참석여부 | 참석(명) | 5\n-사외이사 참석여부 | 불참(명) | -\n6. 감사(감사위원) 참석여부 | 참석\n7. 공시유보 관련내용 | 유보사유 | -\n7. 공시유보 관련내용 | 유보기한 | -\n8. 기타 투자판단에 참고할 사항 | 1. 투자에 관한 주요 사항1) 프로젝트 : 국내 CAM9 신증설 투자2) 투자규모 : 54,000톤/년3) 투자지역 : 경북 포항시 제 4캠퍼스 內2. 당사는 본 시설 투자를 통해 중장기 양극활물질 수요 확대에 대응하며, 신규 제품 라인업 확대로 영업 활동을 강화할 예정입니다.3. 상기 자기자본은 한국채택국제회계기준(K-IFRS)에 따라 작성된 최근 사업연도말 연결 재무제표 기준입니다.4. 상기 투자금액, 투자기간 및 자금조달 계획 등은 집행 과정에서 일부 변경될 수 있습니다.",
      "display_excerpt": "1. 투자구분 | 신규시설 투자\n2. 투자내역 | 투자금액(원) | 473,200,000,000\n2. 투자내역 | 자기자본(원) | 1,488,215,127,423\n2. 투자내역 | 자기자본대비(%) | 31.8\n2. 투자내역 | 대규모법인여부 | 해당\n3. 투자목적 | - 하이니켈 NCM 양극활물질 생산능력 확대- 신규제품 NCMX 생산시설 구축- 단결정 양극활물질 양산라인 확대\n4. 투자기간 | 시작일 | -\n4. 투자기간 | 종료일 | 2024-12-31",
      "source_locator": {
        "corpus_file_path": "raw/exchange/에코프로비엠/20230523900365",
        "sections": null,
        "n_lines": 15
      }
    },
    {
      "document_id": "D02",
      "doc_id": "periodic_20230515001464",
      "rcept_no": "20230515001464",
      "title": "분기보고서 (2023.03) — III. 재무에 관한 사항 / 1. 요약재무정보",
      "document_date": "2023-05-15",
      "source_type": "periodic",
      "doc_subtype": "quarter",
      "report_nm": "분기보고서 (2023.03)",
      "is_correction": false,
      "role": "financials",
      "original_text": "## 1. 요약재무정보\n가. 요약 연결재무정보\n(단위 : 원)\n구분 | 제 8기 1분기 | 제 7기 | 제 6기\n구분 | (2023년 3월말) | (2022년 12월말) | (2021년 12월말)\n[유동자산] | 2,915,180,233,912 | 2,274,293,401,185 | 739,143,497,291\n현금및현금성자산 | 239,036,839,774 | 320,363,496,754 | 104,647,514,160\n매출채권 | 1,146,958,407,186 | 877,390,703,006 | 247,398,852,899\n기타금융자산 | 56,792,077,363 | 40,447,001,849 | 21,891,684,747\n파생상품자산 | 1,525,592,349 | 856,297,113 | 16,200,000\n기타자산 | 238,718,885,713 | 178,818,694,347 | 25,766,352,663\n당기법인세자산 | 111,083,870 | 24,993,840 | 27,013,500\n재고자산 | 1,232,037,347,657 | 856,392,214,276 | 339,395,879,322\n[비유동자산] | 1,226,804,962,099 | 1,099,872,977,790 | 686,714,254,647\n당기손익-공정가치 측정 금융자산 | 13,747,163,462 | 13,223,524,270 | 976,433,477\n기타금융자산 | 1,180,830,602 | 1,158,328,337 | 961,274,250\n유형자산 | 1,122,831,404,869 | 1,003,530,595,126 | 638,848,527,907\n사용권자산 | 3,332,523,242 | 2,873,015,420 | 2,729,793,668\n무형자산 | 15,658,547,687 | 13,428,296,164 | 12,070,439,194\n관계기업투자주식 | 44,431,109,939 | 37,005,146,063 |\n이연법인세자산 | 25,537,389,548 | 25,813,234,288 | 31,127,786,151\n기타자산 | 85,992,750 | 2,840,838,122 |\n자산총계 | 4,141,985,196,011 | 3,374,166,378,975 | 1,425,857,751,938\n[유동부채] | 2,264,333,240,646 | 1,547,889,953,385 | 612,882,217,465\n[비유동부채] | 317,219,783,065 | 338,061,298,167 | 216,830,321,600\n부채총계 | 2,581,553,023,711 | 1,885,951,251,552 | 829,712,539,065\n[지배기업의 소유지분] | 1,405,589,686,684 | 1,363,443,637,314 | 551,699,508,256\n자본금 | 48,940,909,000 | 11,459,733,000\n주식발행초과금 | 877,452,591,737 | 292,925,416,007\n기타포괄손익누계액 | 7,150,571,582 | -7,353,561,026 | 7,248,109\n기타자본항목 | 13,430,989,883 | 12,160,192,314 | 23,304,368,387\n이익잉여금 | 458,614,624,482 | 432,243,505,289 | 224,002,742,753\n[비지배지분] | 154,842,485,616 | 124,771,490,109 | 44,445,704,617\n자본총계 | 1,560,432,172,300 | 1,488,215,127,423 | 596,145,212,873\n| (2023년 1월1일~2023년 3월31일) | (2022년 1월1일~2022년 12월31일) | (2021년 1월 1일~2021년 12월 31일)\n[매출액] | 2,010,989,897,316 | 5,357,607,238,956 | 1,485,628,623,826\n[영업이익] | 107,327,003,425 | 380,676,718,075 | 115,031,248,500\n[당기순이익] | 80,392,620,551 | 272,653,525,172 | 97,789,788,764\n지배기업 소유주지분 | 70,315,871,444 | 232,344,693,490 | 100,835,673,353\n비지배지분 | 10,076,749,107 | 40,308,831,682 | -3,045,884,589\n[총포괄손익] | 94,896,753,159 | 267,004,035,793 | 94,468,129,104\n지배기업 소유주지분 | 84,820,004,052 | 226,667,107,501 | 97,749,027,520\n비지배지분 | 10,076,749,107 | 40,336,928,292 | -3,280,898,416\n[지배기업 지분에 대한 주당순이익] |\n기본주당순이익 | 823 | 2,881 | 4,666\n희석주당순이익 | 823 | 2,881 | 4,425\n연결대상 종속기업의 수 | 4 | 3\n※ 상기 요약 연결재무정보는 한국채택국제회계기준(K-IFRS)에  따라 작성되었습니다.※ 당사는 2022년 6월 28일을 기준일로 1주당 3주의 비율로 신주를 배정하는 무상증자를 실시하였으며, 전전기의 '기본주당순이익', '희석주당순이익'은 새로운 유통보통주식수에 근거하여 계산하였습니다.\n나. 요약 재무정보\n(단위 : 원)\n구분 | 제 8기 1분기 | 제 7기 | 제 6기\n구분 | (2023년 3월말) | (2022년 12월말) | (2021년 12월말)\n[유동자산] | 1,766,023,915,002 | 1,429,749,278,193 | 622,506,068,014\n현금및현금성자산 | 210,798,647,244 | 277,818,663,484 | 23,710,225,088\n매출채권 | 731,433,569,395 | 541,076,172,435 | 244,620,269,819\n기타금융자산 | 54,840,150,712 | 33,309,532,913 | 19,987,150,040\n파생상품자산 | 1,525,592,349 | 856,297,113 | 16,200,000\n기타자산 | 74,169,461,431 | 44,265,231,581 | 17,075,147,697\n재고자산 | 693,256,493,871 | 532,423,380,667 | 317,097,075,370\n[비유동자산] | 1,005,009,995,177 | 917,822,312,893 | 610,691,415,629\n당기손익- 공정가치 측정 금융자산 | 13,747,163,462 | 13,223,524,270 | 976,433,477\n기타금융자산 | 1,411,430,247 | 1,055,200,000 | 923,600,000\n유형자산 | 554,963,514,753 | 537,903,026,872 | 463,287,561,581\n사용권자산 | 2,725,618,884 | 2,303,225,389 | 2,583,915,007\n무형자산 | 13,889,950,304 | 12,312,610,118 | 12,027,537,194\n종속기업투자 | 399,949,612,000 | 329,162,730,000 | 103,162,730,000\n이연법인세자산 | 18,322,705,527 | 19,021,158,122 | 27,729,638,370\n기타자산 | - | 2,840,838,122 | -\n자산총계 | 2,771,033,910,179 | 2,347,571,591,086 | 1,233,197,483,643\n[유동부채] | 1,317,919,499,978 | 888,628,597,469 | 523,478,319,485\n[비유동부채] | 121,080,012,854 | 138,164,428,461 | 150,992,350,112\n부채총계 | 1,438,999,512,832 | 1,026,793,025,930 | 674,470,669,597\n자본금 | 48,940,909,000 | 11,459,733,000\n주식발행초과금 | 877,452,591,737 | 292,925,416,007\n기타자본항목 | 13,563,388,867 | 12,270,060,898 | 23,336,269,471\n이익잉여금 | 392,077,507,743 | 382,115,003,521 | 231,005,395,568\n자본총계 | 1,332,034,397,347 | 1,320,778,565,156 | 558,726,814,046\n종속·관계·공동기업\n투자주식의 평가방법 | 원가법\n| (2023년 1월1일~2023년 3월31일) | (2022년 1월1일 ~2022년 12월 31일) | (2021년 1월 1일 ~2021년 12월 31일)\n[매출액] | 1,253,194,952,074 | 3,415,313,943,369 | 1,486,137,572,535\n[영업이익] | 71,425,671,485 | 262,632,141,341 | 127,265,730,280\n[당기순이익] | 53,907,256,472 | 175,255,683,822 | 106,745,921,263\n[총포괄손익] | 53,907,256,472 | 176,896,762,053 | 104,004,548,058\n[주당순이익] |\n기본주당순이익 | 552 | 1,852 | 1,235\n희석주당순이익 | 552 | 1,852 | 1,171\n※ 상기 요약 재무정보는 한국채택국제회계기준(K-IFRS)에 따라 작성되었습니다.※ 당사는 2022년 6월 28일을 기준일로 1주당 3주의 비율로 신주를 배정하는 무상증자를 실시하였으며, 전전기의 '기본주당순이익', '희석주당순이익'은 새로운 유통보통주식수에 근거하여 계산하였습니다.",
      "display_excerpt": "[유동자산] | 2,915,180,233,912 | 2,274,293,401,185 | 739,143,497,291\n현금및현금성자산 | 239,036,839,774 | 320,363,496,754 | 104,647,514,160\n매출채권 | 1,146,958,407,186 | 877,390,703,006 | 247,398,852,899\n기타금융자산 | 56,792,077,363 | 40,447,001,849 | 21,891,684,747\n파생상품자산 | 1,525,592,349 | 856,297,113 | 16,200,000\n기타자산 | 238,718,885,713 | 178,818,694,347 | 25,766,352,663",
      "source_locator": {
        "corpus_file_path": "raw/periodic/에코프로비엠/20230515001464_quarter_2023_03",
        "sections": [
          "1. 요약재무정보"
        ],
        "n_lines": 87
      }
    },
    {
      "document_id": "D03",
      "doc_id": "periodic_20230515001464",
      "rcept_no": "20230515001464",
      "title": "분기보고서 (2023.03) — II. 사업의 내용",
      "document_date": "2023-05-15",
      "source_type": "periodic",
      "doc_subtype": "quarter",
      "report_nm": "분기보고서 (2023.03)",
      "is_correction": false,
      "role": "business",